{
  "schemaVersion": "1.0.0",
  "reportVersion": "0.1.0",
  "reportId": "WFR-GRAPH-AInvil-Productization-2026-07-06",
  "generatedAt": "2026-07-06T11:27:56.420Z",
  "sourceFiles": [
    {
      "kind": "Production State Graph",
      "path": "state/production_state_graph.json",
      "used": true
    },
    {
      "kind": "Production Intelligence Report",
      "path": "reports/production_intelligence_report.json",
      "used": true
    },
    {
      "kind": "Review Record",
      "path": "reviews/e2e_validation_review.json",
      "used": true
    },
    {
      "kind": "Review Record",
      "path": "reviews/production_core_readiness_review.json",
      "used": true
    },
    {
      "kind": "Benchmark Case",
      "path": "benchmarks/datasets/design_review_poor_gdd.json",
      "used": true
    },
    {
      "kind": "Benchmark Case",
      "path": "benchmarks/datasets/director_feature_creep.json",
      "used": true
    },
    {
      "kind": "Benchmark Case",
      "path": "benchmarks/datasets/gdd_completion_incomplete.json",
      "used": true
    },
    {
      "kind": "Benchmark Case",
      "path": "benchmarks/datasets/technical_translation_average_gdd.json",
      "used": true
    },
    {
      "kind": "Benchmark Case",
      "path": "benchmarks/datasets/validation_missing_evidence.json",
      "used": true
    },
    {
      "kind": "Benchmark Report",
      "path": "benchmarks/reports/latest-benchmark-report.json",
      "used": true
    },
    {
      "kind": "KPI Dashboard",
      "path": "reports/kpi_dashboard.json",
      "used": true
    }
  ],
  "currentState": {
    "projectId": "PROJECT-AInvil-Productization",
    "projectName": "AInvil Productization",
    "graphId": "GRAPH-AInvil-Productization",
    "currentVision": {
      "nodeId": "VISION-AInvil-Productization",
      "title": "AInvil reliable game production workflow",
      "status": "Confirmed",
      "owner": "Director Layer"
    },
    "currentMilestone": {
      "nodeId": "MILESTONE-DRC-MVP-FirstPlayable",
      "title": "Dungeon Recovery Company first playable vertical slice",
      "status": "In Progress",
      "owner": "Orchestrator"
    },
    "activeFeature": {
      "nodeId": "FEAT-DRC-PROC-RecoveryJob",
      "title": "Procedural Recovery Job",
      "status": "Implemented",
      "owner": "GDD Agent"
    },
    "currentNextRecommendedAction": {
      "title": "Run procedural recovery job E2E validation for seeds 1001, 2026, and 7777.",
      "reason": "Procedural generation must prove deterministic layouts, reachable targets, recovery completion, and zero console errors before further gameplay expansion.",
      "owner": "Input Agent",
      "status": "Planned",
      "referencesNodeIds": [
        "FEAT-DRC-PROC-RecoveryJob"
      ],
      "requiredValidationLevel": "Play Mode Verified"
    }
  },
  "workflowBlockers": [
    {
      "kind": "BlockedGraphNode",
      "id": "TASK-E2E-004",
      "summary": "Restore live Unity Bridge connectivity",
      "evidenceNodeIds": [
        "TASK-E2E-004"
      ]
    },
    {
      "kind": "BlockedGraphNode",
      "id": "AC-E2E-002",
      "summary": "Unity live checks reach compile and Play Mode evidence",
      "evidenceNodeIds": [
        "AC-E2E-002"
      ]
    },
    {
      "kind": "MissingTraceabilityLink",
      "id": "REQ-DRC-PROC-003: no implementation task implements this requirement",
      "summary": "REQ-DRC-PROC-003: no implementation task implements this requirement",
      "evidenceNodeIds": []
    },
    {
      "kind": "MissingTraceabilityLink",
      "id": "REQ-DRC-PROC-004: no implementation task implements this requirement",
      "summary": "REQ-DRC-PROC-004: no implementation task implements this requirement",
      "evidenceNodeIds": []
    },
    {
      "kind": "MissingTraceabilityLink",
      "id": "REQ-DRC-SPACE-001: no implementation task implements this requirement",
      "summary": "REQ-DRC-SPACE-001: no implementation task implements this requirement",
      "evidenceNodeIds": []
    },
    {
      "kind": "MissingTraceabilityLink",
      "id": "REQ-DRC-SPACE-002: no implementation task implements this requirement",
      "summary": "REQ-DRC-SPACE-002: no implementation task implements this requirement",
      "evidenceNodeIds": []
    },
    {
      "kind": "MissingTraceabilityLink",
      "id": "REQ-DRC-SPACE-003: no implementation task implements this requirement",
      "summary": "REQ-DRC-SPACE-003: no implementation task implements this requirement",
      "evidenceNodeIds": []
    },
    {
      "kind": "MissingTraceabilityLink",
      "id": "REQ-DRC-SPACE-004: no implementation task implements this requirement",
      "summary": "REQ-DRC-SPACE-004: no implementation task implements this requirement",
      "evidenceNodeIds": []
    },
    {
      "kind": "MissingTraceabilityLink",
      "id": "REQ-DRC-SPACE-005: no implementation task implements this requirement",
      "summary": "REQ-DRC-SPACE-005: no implementation task implements this requirement",
      "evidenceNodeIds": []
    },
    {
      "kind": "MissingTraceabilityLink",
      "id": "REQ-DRC-SPACE-006: no implementation task implements this requirement",
      "summary": "REQ-DRC-SPACE-006: no implementation task implements this requirement",
      "evidenceNodeIds": []
    },
    {
      "kind": "MissingTraceabilityLink",
      "id": "TASK-E2E-001: no Unity target maps to this task",
      "summary": "TASK-E2E-001: no Unity target maps to this task",
      "evidenceNodeIds": []
    },
    {
      "kind": "MissingTraceabilityLink",
      "id": "TASK-E2E-002: no Unity target maps to this task",
      "summary": "TASK-E2E-002: no Unity target maps to this task",
      "evidenceNodeIds": []
    },
    {
      "kind": "MissingTraceabilityLink",
      "id": "TASK-E2E-003: no Unity target maps to this task",
      "summary": "TASK-E2E-003: no Unity target maps to this task",
      "evidenceNodeIds": []
    },
    {
      "kind": "MissingTraceabilityLink",
      "id": "TASK-DRC-MVP-002: no Unity target maps to this task",
      "summary": "TASK-DRC-MVP-002: no Unity target maps to this task",
      "evidenceNodeIds": []
    },
    {
      "kind": "MissingTraceabilityLink",
      "id": "TASK-DRC-MVP-003: no Unity target maps to this task",
      "summary": "TASK-DRC-MVP-003: no Unity target maps to this task",
      "evidenceNodeIds": []
    },
    {
      "kind": "MissingTraceabilityLink",
      "id": "TASK-DRC-PROC-003: no Unity target maps to this task",
      "summary": "TASK-DRC-PROC-003: no Unity target maps to this task",
      "evidenceNodeIds": []
    },
    {
      "kind": "MissingTraceabilityLink",
      "id": "TASK-DRC-PROC-004: no Unity target maps to this task",
      "summary": "TASK-DRC-PROC-004: no Unity target maps to this task",
      "evidenceNodeIds": []
    },
    {
      "kind": "MissingTraceabilityLink",
      "id": "TASK-DRC-PROC-005: no Unity target maps to this task",
      "summary": "TASK-DRC-PROC-005: no Unity target maps to this task",
      "evidenceNodeIds": []
    },
    {
      "kind": "MissingTraceabilityLink",
      "id": "TASK-DRC-PROC-006: no Unity target maps to this task",
      "summary": "TASK-DRC-PROC-006: no Unity target maps to this task",
      "evidenceNodeIds": []
    },
    {
      "kind": "MissingTraceabilityLink",
      "id": "TASK-DRC-PROC-007: no Unity target maps to this task",
      "summary": "TASK-DRC-PROC-007: no Unity target maps to this task",
      "evidenceNodeIds": []
    },
    {
      "kind": "MissingTraceabilityLink",
      "id": "TASK-DRC-PROC-008: no Unity target maps to this task",
      "summary": "TASK-DRC-PROC-008: no Unity target maps to this task",
      "evidenceNodeIds": []
    },
    {
      "kind": "MissingTraceabilityLink",
      "id": "TASK-DRC-VIS-001: no Unity target maps to this task",
      "summary": "TASK-DRC-VIS-001: no Unity target maps to this task",
      "evidenceNodeIds": []
    },
    {
      "kind": "MissingTraceabilityLink",
      "id": "TASK-DRC-VIS-002: no Unity target maps to this task",
      "summary": "TASK-DRC-VIS-002: no Unity target maps to this task",
      "evidenceNodeIds": []
    },
    {
      "kind": "MissingTraceabilityLink",
      "id": "TASK-DRC-SPACE-001: no Unity target maps to this task",
      "summary": "TASK-DRC-SPACE-001: no Unity target maps to this task",
      "evidenceNodeIds": []
    },
    {
      "kind": "MissingTraceabilityLink",
      "id": "TASK-DRC-SPACE-002: no Unity target maps to this task",
      "summary": "TASK-DRC-SPACE-002: no Unity target maps to this task",
      "evidenceNodeIds": []
    },
    {
      "kind": "MissingTraceabilityLink",
      "id": "TASK-DRC-SPACE-003: no Unity target maps to this task",
      "summary": "TASK-DRC-SPACE-003: no Unity target maps to this task",
      "evidenceNodeIds": []
    },
    {
      "kind": "MissingTraceabilityLink",
      "id": "TASK-DRC-SPACE-004: no Unity target maps to this task",
      "summary": "TASK-DRC-SPACE-004: no Unity target maps to this task",
      "evidenceNodeIds": []
    },
    {
      "kind": "MissingTraceabilityLink",
      "id": "TASK-DRC-SPACE-005: no Unity target maps to this task",
      "summary": "TASK-DRC-SPACE-005: no Unity target maps to this task",
      "evidenceNodeIds": []
    },
    {
      "kind": "MissingTraceabilityLink",
      "id": "TASK-DRC-SPACE-006: no Unity target maps to this task",
      "summary": "TASK-DRC-SPACE-006: no Unity target maps to this task",
      "evidenceNodeIds": []
    },
    {
      "kind": "MissingTraceabilityLink",
      "id": "AC-E2E-002: no validation evidence validates this acceptance criterion",
      "summary": "AC-E2E-002: no validation evidence validates this acceptance criterion",
      "evidenceNodeIds": []
    },
    {
      "kind": "MissingRequiredReview",
      "id": "Production Review",
      "summary": "Active feature has no review record.",
      "evidenceNodeIds": [
        "FEAT-DRC-PROC-RecoveryJob"
      ]
    },